product_id,name,quantity_in_stock,unit_price
607,"RETRO MOD TRAY",138,61.89
608,"ENAMEL FIRE BUCKET CREAM",73,96.07
609,"AIRLINE LOUNGE,METAL SIGN",137,30.02
610,"KEY FOB , BACK DOOR",50,15.09
611,"KEY FOB , GARAGE DESIGN",16,71.52
612,"KEY FOB , SHED",36,55.35
613,"KEY FOB , FRONT  DOOR",79,76.57
614,"CARD CAT AND TREE",35,47.97
615,"CARD CIRCUS PARADE",48,51.27
616,"CARD PARTY GAMES",135,71.78
617,"CARD BILLBOARD FONT",90,27.77
618,"BOTANICAL LAVENDER BIRTHDAY CARD",49,73.90
619,"VINTAGE RED TEATIME MUG",24,57.87
620,"MIRRORED DISCO BALL",109,46.75
621,"DISCO BALL ROTATOR BATTERY OPERATED",102,12.39
622,"WOODEN OWLS LIGHT GARLAND",33,29.88
623,"GAOLERS KEYS DECORATIVE GARDEN",113,39.60
624,"KIDS RAIN MAC BLUE",111,16.07
625,"BIRD DECORATION RED RETROSPOT",58,60.23
626,"WOODEN SCHOOL COLOURING SET",103,89.90
627,"PACK OF 12 TRADITIONAL CRAYONS",15,2.46
628,"VINTAGE BILLBOARD TEA MUG",95,70.20
629,"MONEY BOX CONFECTIONERY DESIGN",92,75.40
630,"WOODEN TREE CHRISTMAS SCANDINAVIAN",125,91.79
631,"KITCHEN METAL SIGN",20,59.34
632,"GLASS CLOCHE SMALL",91,24.62
633,"ASSORTED COLOUR T-LIGHT HOLDER",81,15.79
634,"WEEKEND BAG VINTAGE ROSE PAISLEY",35,70.58
635,"CERAMIC CAKE BOWL + HANGING CAKES",6,5.01
636,"CHRISTMAS CARD SCREEN PRINT",8,95.66
637,"CHRISTMAS CARD STACK OF PRESENTS",104,87.56
638,"BROCADE RING PURSE",14,96.82
639,"POLYESTER FILLER PAD 40x40cm",39,2.27
640,"IVORY PILLAR CANDLE SILVER FLOCK",52,93.32
641,"SILVER FISHING GNOME",111,11.44
642,"ROUND SNACK BOXES SET OF 4 FRUITS",39,1.28
643,"PARTY INVITES JAZZ HEARTS",79,98.10
644,"PARTY INVITES DINOSAURS",19,62.01
645,"NUMBER TILE COTTAGE GARDEN 9",11,2.62
646,"NUMBER TILE COTTAGE GARDEN 1",148,43.54
647,"NUMBER TILE COTTAGE GARDEN No",142,73.47
648,"ENAMEL WATERING CAN CREAM",37,63.80
649,"DOORSTOP RETROSPOT HEART",72,89.44
650,"SET OF 3 BLACK FLYING DUCKS",0,22.90
651,"BROCANTE SHELF WITH HOOKS",103,63.42
652,"BLUE/CREAM STRIPE CUSHION COVER",92,28.52
653,"UNION STRIPE CUSHION COVER",59,71.73
654,"KEY CABINET MA CAMPAGNE",45,76.50
655,"CREAM CUPID HEARTS COAT HANGER",124,97.88
656,"CREAM SWEETHEART MINI CHEST",54,19.82
657,"HANGING METAL HEART LANTERN",35,9.24
658,"HANGING METAL STAR LANTERN",141,66.20
659,"PEACE SMALL WOOD LETTERS",145,10.47
660,"DINOSAUR PARTY BAG + STICKER SET",122,21.94
661,"EUCALYPTUS & PINECONE  WREATH",131,38.31
662,"VINTAGE RED KITCHEN CABINET",55,67.42
663,"LARGE CAKE STAND HANGING HEARTS",55,65.06
664,"RED RETROSPOT SHOPPING BAG",138,8.66
665,"TEA TIME TABLE CLOTH",18,77.01
666,"TEA TIME KITCHEN APRON",140,2.73
667,"RED DINER WALL CLOCK",98,91.02
668,"WRAP PINK FAIRY CAKES",150,20.47
669,"WRAP ENGLISH ROSE",137,71.02
670,"WOOD S/3 CABINET ANT WHITE FINISH",109,55.13
671,"WRAP  PINK FLOCK",6,41.99
672,"PACK OF 12 RED RETROSPOT TISSUES",14,53.64
673,"12 PENCILS TALL TUBE POSY",140,93.99
674,"TUB 24 PINK FLOWER PEGS",112,72.42
675,"PINK POLKADOT WRAP",4,88.94
676,"FENG SHUI PILLAR CANDLE",76,21.45
677,"CHINESE DRAGON PAPER LANTERNS",77,91.59
678,"VINTAGE KID DOLLY CARD",121,41.76
679,"SWALLOWS GREETING CARD",66,61.32
680,"GIN & TONIC DIET GREETING CARD",13,7.92
681,"FANCY FONT BIRTHDAY CARD,",71,40.09
682,"ELEPHANT, BIRTHDAY CARD,",100,49.45
683,"CAKE STAND WHITE TWO TIER LACE",24,75.95
684,"FIRST AID TIN",138,7.05
685,"PICTURE FRAME WOOD TRIPLE PORTRAIT",100,6.69
686,"CREAM SWEETHEART LETTER RACK",14,75.69
687,"36 PENCILS TUBE WOODLAND",17,73.27
688,"PINK HAPPY BIRTHDAY BUNTING",23,67.11
689,"JUMBO BAG CHARLIE AND LOLA TOYS",101,97.74
690,"AGED GLASS SILVER T-LIGHT HOLDER",24,63.50
691,"GLITTER STAR GARLAND WITH BELLS",78,22.89
692,"FOLDING UMBRELLA RED/WHITE POLKADOT",19,46.29
693,"36 PENCILS TUBE SKULLS",125,96.76
694,"36 PENCILS TUBE RED RETROSPOT",94,21.24
695,"RECIPE BOX RETROSPOT",76,91.73
696,"SET/5 RED RETROSPOT LID GLASS BOWLS",133,78.61
697,"ENAMEL FLOWER JUG CREAM",63,79.63
698,"SWEETHEART WIRE MAGAZINE RACK",0,14.44
699,"RED SPOT CERAMIC DRAWER KNOB",81,14.66
700,"SET/6 BEAD COASTERS GAUZE BAG GOLD",128,45.46
701,"GROW YOUR OWN HERBS SET OF 3",81,84.63
702,"GROW YOUR OWN FLOWERS SET OF 3",0,45.25
703,"CHEST OF DRAWERS GINGHAM HEART",22,90.36
704,"WOODEN ROUNDERS GARDEN SET",126,66.35
705,"WOODEN CROQUET GARDEN SET",119,10.66
706,"FELTCRAFT PRINCESS OLIVIA DOLL",122,81.43
707,"WHITE CHRISTMAS STAR DECORATION",1,96.44
708,"ALARM CLOCK BAKELIKE IVORY",107,62.51
709,"DOORMAT MERRY CHRISTMAS RED",19,55.44
710,"CARDHOLDER GINGHAM CHRISTMAS TREE",35,33.27
711,"PARTY CONES CANDY ASSORTED",134,85.16
712,"CABIN BAG VINTAGE PAISLEY",38,90.10
713,"CLASSICAL ROSE SMALL VASE",121,89.85
714,"SAVE THE PLANET MUG",96,86.01
715,"HAND WARMER RED POLKA DOT",81,41.79
716,"FAMILY ALBUM WHITE PICTURE FRAME",54,35.85
717,"FAUX FUR CHOCOLATE THROW",103,85.02
718,"RIBBON REEL LACE DESIGN",92,32.32
719,"LUSH GREENS RIBBONS",18,79.79
720,"BRIGHT BLUES RIBBONS",121,58.95
721,"URBAN BLACK RIBBONS",11,71.92
722,"GLASS STAR FROSTED T-LIGHT HOLDER",102,16.50
723,"CERAMIC CAKE STAND + HANGING CAKES",133,25.62
724,"PINK POLKADOT BOWL",95,50.49
725,"PACK OF 6 SANDCASTLE FLAGS ASSORTED",49,59.73
726,"ROUND CAKE TIN VINTAGE GREEN",21,71.33
727,"PACK OF 6 SWEETIE GIFT BOXES",133,81.76
728,"PACK OF 6 PANNETONE GIFT BOXES",1,32.28
729,"BEADED PEARL HEART WHITE ON STICK",36,28.63
730,"CHILDS BREAKFAST SET CIRCUS PARADE",28,89.96
731,"FROG CANDLE",54,14.19
732,"VINTAGE RED MUG",62,78.30
733,"RETROSPOT CHILDRENS APRON",58,90.99
734,"MULTICOLOUR 3D BALLS GARLAND",111,9.29
735,"LOVE LARGE WOOD LETTERS",24,82.77
736,"SET OF 6 FUNKY BEAKERS",118,66.22
737,"GLASS  BEURRE DISH",4,16.42
738,"CHOCOLATE THIS WAY METAL SIGN",51,3.92
739,"EMPIRE BIRTHDAY CARD",109,81.18
740,"OVAL WALL MIRROR DIAMANTE",57,16.84
741,"METAL 4 HOOK HANGER FRENCH CHATEAU",105,44.48
742,"MILK PAN PINK POLKADOT",75,19.86
743,"METAL SIGN NEIGHBOURHOOD WITCH",47,96.41
744,"ENAMEL MEASURING JUG CREAM",46,8.24
745,"PINK BABY BUNTING",68,81.35
746,"PHOTO FRAME CORNICE",119,75.07
747,"SOLDIERS EGG CUP",94,3.28
748,"S/15 SILVER GLASS BAUBLES IN BAG",102,69.20
749,"TEATIME FUNKY FLOWER BACKPACK FOR 2",108,99.67
750,"HEARTS WRAPPING TAPE",95,75.13
