product_id,name,quantity_in_stock,unit_price
1,"TOMATO CHARLIE+LOLA COASTER SET",4,98.05
2,"CHARLIE & LOLA WASTEPAPER BIN FLORA",149,31.89
3,"RED CHARLIE+LOLA PERSONAL DOORSIGN",137,66.71
4,"GIRLY PINK TOOL SET",104,35.37
5,"YELLOW BREAKFAST CUP AND SAUCER",82,14.80
6,"PHOTO CLIP LINE",134,82.11
7,"BLUE OWL SOFT TOY",75,53.00
8,"APPLE GREEN JUMPER",145,40.41
9,"FRIDGE MAGNETS US DINER ASSORTED",81,95.53
10,"SET OF 3 GOLD FLYING DUCKS",97,18.75
11,"RUSTIC  SEVENTEEN DRAWER SIDEBOARD",143,93.78
12,"PARTY CONES CARNIVAL ASSORTED",81,49.63
13,"BOUDOIR SQUARE TISSUE BOX",118,48.21
14,"LAVENDER INCENSE IN TIN",117,37.54
15,"SILVER LOOKING MIRROR",7,48.23
16,"SNOWFLAKE PORTABLE TABLE LIGHT",128,34.77
17,"PINK OVAL JEWELLED MIRROR",67,29.94
18,"SET OF 6 GIRLS CELEBRATION CANDLES",79,92.90
19,"NATURAL SLATE RECTANGLE CHALKBOARD",39,45.11
20,"PENS ASSORTED FUNNY FACE",90,35.55
21,"WRAP COWBOYS",55,60.12
22,"CARD BIRTHDAY COWBOY",115,45.79
23,"CLEAR ACRYLIC FACETED BANGLE",148,72.21
24,"FLOWERS  STICKERS",11,30.86
25,"PINK B'FLY C/COVER W BOBBLES",94,97.41
26,"BOOM BOX SPEAKER GIRLS",1,77.15
27,"6 RIBBONS SHIMMERING PINKS",36,17.81
28,"5 STRAND GLASS NECKLACE CRYSTAL",138,56.51
29,"PAINTED METAL STAR WITH HOLLY BELLS",58,63.67
30,"12 DAISY PEGS IN WOOD BOX",44,52.34
31,"FOLDING UMBRELLA CREAM POLKADOT",15,60.36
32,"TURQUOISE CHRISTMAS TREE",74,4.78
33,"MAGIC DRAWING SLATE GO TO THE FAIR",66,19.27
34,"CERAMIC STRAWBERRY MONEY BOX",120,45.02
35,"RETROSPOT BABUSHKA DOORSTOP",62,70.73
36,"SWEETHEART WIRE WALL TIDY",144,44.66
37,"NAMASTE SWAGAT INCENSE",42,10.07
38,"4 IVORY DINNER CANDLES SILVER FLOCK",100,4.52
39,"CHRYSANTHEMUM NOTEBOOK",146,87.63
40,"SMALL CHINESE STYLE SCISSOR",7,69.36
41,"BLUE NEW BAROQUE CANDLESTICK CANDLE",18,73.33
42,"HYACINTH BULB T-LIGHT CANDLES",15,90.71
43,"BLACK SWEETHEART BRACELET",52,40.27
44,"DIAMANTE HAIR GRIP PACK/2 BLACK DIA",139,22.43
45,"DIAMANTE HAIR GRIP PACK/2 RUBY",8,23.40
46,"DIAMANTE HAIR GRIP PACK/2 MONTANA",21,98.41
47,"CHRISTMAS TREE T-LIGHT HOLDER",89,83.99
48,"MINI FUNKY DESIGN TAPES",122,48.52
49,"BLUE ROSE FABRIC MIRROR",112,55.95
50,"THREE CANVAS LUGGAGE TAGS",108,47.01
51,"SET OF 2 TINS JARDIN DE PROVENCE",11,8.70
52,"HEART T-LIGHT HOLDER",18,97.27
53,"MIRRORED WALL ART FOXY",99,10.70
54,"MIRRORED WALL ART GENTS",144,56.79
55,"POTTING SHED SOW 'N' GROW SET",52,75.97
56,"VINTAGE UNION JACK CUSHION COVER",68,86.50
57,"POLYESTER FILLER PAD 45x45cm",83,35.36
58,"BLUE BIRDHOUSE DECORATION",143,35.80
59,"SET OF 2 WOODEN MARKET CRATES",49,50.29
60,"CLASSIC FRENCH STYLE BASKET NATURAL",89,23.30
61,"CRAZY DAISY HEART DECORATION",30,64.65
62,"SMALL STRIPES CHOCOLATE GIFT BAG",118,4.99
63,"PINK UNION JACK  LUGGAGE TAG",62,49.60
64,"SET OF 4 NAPKIN CHARMS LEAVES",12,71.17
65,"SET OF 4 NAPKIN CHARMS STARS",41,33.15
66,"PLACE SETTING WHITE STAR",82,97.85
67,"GARLAND WOODEN HAPPY EASTER",86,96.22
68,"CALENDAR IN SEASON DESIGN",45,99.52
69,"PINK PAISLEY SQUARE TISSUE BOX",31,84.59
70,"TOAST ITS - HAPPY BIRTHDAY",16,35.21
71,"SET/10 IVORY POLKADOT PARTY CANDLES",144,4.62
72,"BLACK ORANGE SQUEEZER",2,51.41
73,"MULTICOLOUR  CONFETTI IN TUBE",46,30.13
74,"PINK HEARTS PAPER GARLAND",110,20.72
75,"SET/10 BLUE POLKADOT PARTY CANDLES",121,94.96
76,"4 PURPLE FLOCK DINNER CANDLES",90,12.71
77,"PINK & WHITE BREAKFAST TRAY",5,75.31
78,"SET/10 PINK POLKADOT PARTY CANDLES",104,22.92
79,"T-LIGHT HOLDER HANGING LACE",59,72.95
80,"CREAM SLICE FLANNEL CHOCOLATE SPOT",138,80.81
81,"ASS COL SMALL SAND GECKO P'WEIGHT",31,41.69
82,"BLUE PAPER PARASOL",55,16.96
83,"HANGING MEDINA LANTERN SMALL",141,81.56
84,"5 HOOK HANGER RED MAGIC TOADSTOOL",41,60.12
85,"ASSORTED COLOUR LIZARD SUCTION HOOK",14,88.08
86,"STRING OF STARS CARD HOLDER",84,69.63
87,"MILK BOTTLE WITH GLASS STOPPER",124,95.03
88,"SET/4 MODERN VINTAGE COTTON NAPKINS",118,13.14
89,"SWALLOW SQUARE TISSUE BOX",14,68.94
90,"SILVER GLASS T-LIGHT SET",123,48.58
91,"RIDGED GLASS FINGER BOWL",35,61.97
92,"RIDGED GLASS STORAGE JAR CREAM LID",108,66.76
93,"BIRTHDAY CARD, RETRO SPOT",4,60.18
94,"FANCY FONTS BIRTHDAY WRAP",37,26.44
95,"BLACK DINER WALL CLOCK",101,23.48
96,"MINI JIGSAW BAKE A CAKE",73,75.21
97,"BLUE PAISLEY TISSUE BOX",125,31.80
98,"PACK OF 12 BLUE PAISLEY TISSUES",89,55.60
99,"PACK OF 12 CIRCUS PARADE TISSUES",119,60.06
100,"IF YOU CAN'T STAND THE HEAT MUG",104,82.07
101,"BISCUIT TIN VINTAGE RED",49,80.21
102,"FRENCH BLUE METAL DOOR SIGN 5",148,29.94
103,"SILVER PLATE CANDLE BOWL SMALL",81,26.28
104,"SMALL REGAL  SILVER CANDLEPOT",138,93.66
105,"RED FLOWER CROCHET FOOD COVER",32,42.67
106,"CHERRY CROCHET FOOD COVER",58,23.62
107,"STRAWBERRY RAFFIA FOOD COVER",31,87.51
108,"SILVER  CANDLEPOT JARDIN",33,14.64
109,"CREAM SWEETHEART WALL CABINET",143,72.34
110,"ROMANTIC IMAGES NOTEBOOK SET",69,81.14
111,"CURIOUS  IMAGES NOTEBOOK SET",29,5.49
112,"BLUE CHARLIE+LOLA PERSONAL DOORSIGN",37,3.68
113,"CHARLIE+LOLA"EXTREMELY BUSY" SIGN",129,4.19
114,"LOLITA  DESIGN  COTTON TOTE BAG",41,22.09
115,CARRIAGE,129,1.65
116,"RAIN PONCHO RETROSPOT",8,31.30
117,"GLITTER CHRISTMAS TREE WITH BELLS",48,73.62
118,"POTTING SHED SEED ENVELOPES",39,2.65
119,"BLACK PIRATE TREASURE CHEST",22,89.84
120,"SLATE TILE NATURAL HANGING",84,5.00
121,"MILK PAN RED RETROSPOT",117,77.18
122,"EASTER DECORATION NATURAL CHICK",20,18.38
123,"PARTY PIZZA DISH BLUE POLKADOT",34,82.11
124,"PAPERWEIGHT KINGS CHOICE",72,74.82
125,"BIRDHOUSE GARDEN MARKER",22,2.30
126,"DAISY GARDEN MARKER",119,64.20
127,"CHILDS GARDEN RAKE PINK",127,34.47
128,"PACK OF 12 SPACEBOY TISSUES",51,17.19
129,"GUMBALL MONOCHROME COAT RACK",0,69.70
130,"CHALKBOARD KITCHEN ORGANISER",78,75.44
131,"RED VICTORIAN FABRIC OVAL BOX",148,56.21
132,"PINK CHRISTMAS FLOCK DROPLET",61,22.76
133,"ACRYLIC JEWEL ICICLE, PINK",130,54.27
134,"ROSE FOLKART HEART DECORATIONS",136,53.04
135,"CONDIMENT TRAY 4 BOWLS AND 4 SPOONS",54,74.58
136,"IVORY PILLAR CANDLE GOLD FLOCK",60,24.47
137,"TUMBLER, BAROQUE",72,65.14
138,"TUMBLER, NEW ENGLAND",69,34.46
139,"SET OF 6 VINTAGE NOTELETS KIT",51,37.91
140,"BEADED CRYSTAL HEART PINK SMALL",45,81.06
141,"MIDNIGHT BLUE PAIR HEART HAIR SLIDE",71,60.20
142,"SILVER M.O.P ORBIT DROP EARRINGS",86,86.85
143,"EDWARDIAN DROP EARRINGS JET BLACK",99,78.25
144,"RUBY GLASS CLUSTER EARRINGS",60,57.83
145,"FRUIT SALAD BAG CHARM",134,45.38
146,"GREEN MURANO TWIST BRACELET",35,8.34
147,"PINK GLASS TASSLE BAG CHARM",120,90.90
148,"TURQUOISE GLASS TASSLE BAG CHARM",123,93.81
149,"SILVER LARIAT BLACK STONE EARRINGS",139,55.88
150,"LETTER "D" BLING KEY RING",100,80.57
151,"FAIRY CAKES NOTEBOOK A6 SIZE",121,48.30
152,"SOFT PINK ROSE TOWEL",116,38.78
153,"DENIM PATCH PURSE PINK BUTTERFLY",35,38.56
154,"ASSTD DESIGN RACING CAR PEN",82,64.06
155,"ORIGAMI SANDLEWOOD INCENSE+FLOWER",145,90.08
156,"BLUE GLASS GEMS IN BAG",142,25.33
157,"VIPPASSPORT COVER",1,57.42
158,"FIRST CLASS HOLIDAY PURSE",32,61.60
159,"STRAWBERRY DREAM CHILDS UMBRELLA",101,91.71
160,"GARDEN PATH JOURNAL",99,92.45
161,"FRENCH LATTICE CUSHION COVER",29,56.65
162,"FRENCH PAISLEY CUSHION COVER",43,29.08
163,"FRENCH FLORAL CUSHION COVER",29,12.01
164,"PINK ROSE FABRIC MIRROR",52,47.66
165,"JAZZ HEARTS ADDRESS BOOK",82,1.82
166,"ROSE DU SUD COSMETICS BAG",130,72.82
167,"ROSE CARAVAN DOORSTOP",94,1.47
168,"WHITE HONEYCOMB PAPER GARLAND",25,75.33
169,"MIRRORED WALL ART PHOTO FRAMES",58,55.67
170,"ASSORTED MINI MADRAS NOTEBOOK",70,40.96
171,"ASSORTED TUTTI FRUTTI KEYRING BALL",41,92.42
172,"VINTAGE GLASS COFFEE CADDY",33,68.30
173,"BOYS VINTAGE TIN SEASIDE BUCKET",60,5.09
174,"LARGE ROUND WICKER PLATTER",137,11.09
175,"VINTAGE SHELLS PRINT",144,17.86
176,"5 HOOK HANGER MAGIC TOADSTOOL",135,3.54
177,"PORCELAIN HANGING BELL SMALL",24,79.44
178,"PAINTED LIGHTBULB STAR+ MOON",46,73.85
179,"BLACK TEA TOWEL CLASSIC DESIGN",83,18.52
180,"CHRISTMAS MUSICAL ZINC STAR",104,36.51
181,"CHRISTMAS MUSICAL ZINC HEART",1,87.83
182,"SKULLS AND CROSSBONES WRAP",78,51.37
183,"PINK FLOWER FABRIC PONY",50,96.01
184,"CAMOUFLAGE DESIGN TEDDY",36,69.30
185,"HOME SMALL WOOD LETTERS",7,80.81
186,"FEATHER PEN,LIGHT PINK",42,96.57
187,"NUMBER TILE COTTAGE GARDEN 8",74,42.09
188,"DOORMAT TOPIARY",33,39.54
189,"MAGNETS PACK OF 4 HOME SWEET HOME",27,65.81
190,"MAGNETS PACK OF 4 CHILDHOOD MEMORY",141,1.95
191,"SET 12 LAVENDER  BOTANICAL T-LIGHTS",140,33.52
192,"OFFICE MUG WARMER PINK",71,20.43
193,"SMALL HANGING IVORY/RED WOOD BIRD",130,6.98
194,"MIRRORED WALL ART TABLE LAMP",91,84.17
195,"MIRRORED WALL ART SPLODGES",95,85.80
196,"SET OF 2 ROUND TINS DUTCH CHEESE",149,80.00
197,"EMERGENCY FIRST AID TIN",23,69.23
198,"NEWSPAPER STAND",133,41.56
199,"CINAMMON & ORANGE WREATH",107,54.34
200,"SET OF 4 NAPKIN CHARMS HEARTS",64,54.69
201,"SET OF 4 NAPKIN CHARMS 3 KEYS",107,96.87
202,"SET OF 4 NAPKIN CHARMS INSTRUMENT",97,85.16
203,"SET OF 4 NAPKIN CHARMS CROWNS",58,7.17
204,"CHRISTMAS GARLAND STARS,TREES",108,65.71
205,"WHITE CHRISTMAS GARLAND STARS TREES",46,9.39
206,"PAINTED METAL HEART WITH HOLLY BELL",60,82.79
207,"BIRD BOX CHRISTMAS TREE DECORATION",2,70.54
208,"DECORATIVE PLANT POT WITH FRIEZE",132,9.29
209,"WOOD AND GLASS MEDICINE CABINET",108,75.65
210,"TABLE LAMP WHITE SHADE WOOD BASE",85,15.99
211,"SMALL HANGING GLASS+ZINC LANTERN",134,96.20
212,"GREEN CHRISTMAS TREE STRING 20LIGHT",104,93.75
213,"PEACE WOODEN BLOCK LETTERS",87,72.03
214,"CHRISTMAS HANGING HEART WITH BELL",87,14.81
215,"GLITTER CHRISTMAS TREE",95,58.80
216,"WICKER WREATH SMALL",14,61.43
217,"PINK MARSHMALLOW SCARF KNITTING KIT",102,18.11
218,"CHILDRENS SPACEBOY MUG",98,25.77
219,"MIRRORED WALL ART SKULLS",142,23.15
220,"MIRRORED WALL ART STARS",60,2.29
221,"RING OF ROSES BIRTHDAY CARD",11,39.25
222,"HEADS AND TAILS SPORTING FUN",100,87.18
223,"LETTER "M" BLING KEY RING",145,94.97
224,"LETTER "V" BLING KEY RING",13,18.51
225,"LETTER "J" BLING KEY RING",131,48.67
226,"SQUARE FLOOR CUSHION VINTAGE RED",7,44.16
227,"GREEN FERN JOURNAL",136,75.69
228,"SET OF 4 ROSE BOTANICAL CANDLES",86,33.59
229,"KINGS CHOICE BISCUIT TIN",130,80.74
230,"FUNKY MONKEY GIFT BAG MEDIUM",148,37.45
231,"KITTY PENCIL ERASERS",147,80.08
232,"ORIGAMI VANILLA INCENSE/CANDLE SET",71,92.25
233,"ORIGAMI JASMINE INCENSE/CANDLE SET",145,46.12
234,"ORIGAMI LAVENDER INCENSE/CANDL SET",146,65.82
235,"ORIGAMI ROSE INCENSE/CANDLE SET",5,8.80
236,"ORIGAMI OPIUM INCENSE/CANDLE SET",105,60.94
237,"ORIGAMI SANDLEWOOD INCENSE/CAND SET",25,39.00
238,"ORIGAMI VANILLA INCENSE CONES",53,21.18
239,"FAIRY DREAMS INCENSE",76,20.46
240,"DRAGONS BLOOD INCENSE",75,78.61
241,"CHERRY BLOSSOM PASSPORT COVER",107,51.31
242,"FIRST CLASS PASSPORT COVER",28,20.46
243,"TROPICAL PASSPORT COVER",83,14.65
244,"CHERRY BLOSSOM LUGGAGE TAG",61,13.51
245,"FLORAL SOFT CAR TOY",45,93.89
246,"GREEN CAT FLORAL CUSHION COVER",66,94.25
247,"BLUE PAISLEY SKETCHBOOK",74,44.59
248,"BLACK EAR MUFF HEADPHONES",89,99.78
249,"BLUE POT PLANT CANDLE",56,5.04
250,"TOOL BOX SOFT TOY",57,16.80
251,"LARGE CAKE TOWEL PINK SPOTS",111,69.13
252,"GOLD FISHING GNOME",45,52.32
253,"3D HEARTS  HONEYCOMB PAPER GARLAND",150,49.69
254,"PASTEL COLOUR HONEYCOMB FAN",18,18.21
255,"VINTAGE KITCHEN PRINT FRUITS",94,79.94
256,"VINTAGE KITCHEN PRINT SEAFOOD",83,45.23
257,"CLASSIC METAL BIRDCAGE PLANT HOLDER",34,87.51
258,"12 IVORY ROSE PEG PLACE SETTINGS",12,76.76
259,"CERAMIC BIRDHOUSE CRESTED TIT SMALL",60,40.68
260,"LETS GO SHOPPING COTTON TOTE BAG",60,11.95
261,"Dr. Jam's Arouzer Stress Ball",22,35.17
262,"ASSORTED TUTTI FRUTTI SMALL PURSE",73,32.01
263,"RIDGED GLASS POSY VASE",45,95.00
264,"SMALL MEDINA STAMPED METAL BOWL",87,42.54
265,"RED METAL BEACH SPADE",72,61.99
266,"DECORATIVE FLORE BATHROOM BOTTLE",67,28.98
267,"RECIPE BOX WITH METAL HEART",17,30.67
268,"KIDS RAIN MAC PINK",61,59.82
269,"CHRISTMAS HANGING TREE WITH BELL",3,47.10
270,"HEARTS GIFT TAPE",56,40.62
271,"EMPIRE TISSUE BOX",110,55.58
272,"SKULLS SQUARE TISSUE BOX",95,91.71
273,"SET OF 2 TEA TOWELS PING MICROWAVE",119,39.20
274,"LADLE LOVE HEART RED",63,51.42
275,"CAKE STAND VICTORIAN FILIGREE LARGE",35,58.47
276,"FELT EGG COSY BLUE RABBIT",97,2.45
277,"FELT EGG COSY WHITE RABBIT",103,86.68
278,"FELT EGG COSY CHICKEN",114,29.30
279,"6 EGG HOUSE PAINTED WOOD",30,28.46
280,"FIVE CATS HANGING DECORATION",114,65.21
281,"HOME GARLAND PAINTED ZINC",145,60.14
282,"PAPERWEIGHT VINTAGE COLLAGE",3,2.33
283,"CAST IRON HOOK GARDEN FORK",29,96.45
284,"CAST IRON HOOK GARDEN TROWEL",66,8.06
285,"WHITE WOOD GARDEN PLANT LADDER",81,17.91
286,"MINI JIGSAW DINOSAUR",79,48.30
287,"FRENCH GARDEN SIGN BLUE METAL",45,92.02
288,"CARD I LOVE LONDON",150,91.20
289,"FUNKY DIVA PEN",73,12.48
290,"MAKE YOUR OWN PLAYTIME CARD KIT",129,46.45
291,"BROCANTE COAT RACK",122,11.52
292,"WHITE BROCANTE SOAP DISH",83,36.81
293,"CREAM SWEETHEART EGG HOLDER",145,53.29
294,"NUMBER TILE COTTAGE GARDEN 2",24,37.83
295,"BLUE VICTORIAN FABRIC OVAL BOX",61,60.40
296,"BLACK CHRISTMAS TREE 60CM",84,33.43
297,"PINK AND WHITE CHRISTMAS TREE 120CM",67,13.48
298,"IVORY STRING CURTAIN WITH POLE",69,38.62
299,"BLUE FELT HANGING HEART W FLOWER",130,67.61
300,"PINK FELT HANGING HEART W FLOWER",20,23.63
301,"FOLKART CLIP ON STARS",59,55.52
302,"PINK BREAKFAST CUP AND SAUCER",59,87.79
303,"YELLOW/PINK CERAMIC CANDLE HOLDER",10,95.60
304,"SUNSET COLOUR CHUNKY KNITTED THROW",14,33.20
305,"RETRO LONGBOARD IRONING BOARD COVER",14,61.94
306,"CAROUSEL DESIGN WASHBAG",134,8.60
307,"COLUMBIAN  CUBE CANDLE",54,83.13
308,"METAL SIGN,CUPCAKE SINGLE HOOK",19,16.91
309,"METAL SIGN CUPCAKE SINGLE HOOK",64,8.39
310,"PINK/PURPLE RETRO RADIO",73,5.22
311,"YELLOW METAL CHICKEN HEART",124,23.09
312,"MIXED NUTS LIGHT GREEN BOWL",25,53.63
313,"TALL ROCOCO CANDLE HOLDER",90,16.35
314,"JUNGLE POPSICLES ICE LOLLY HOLDERS",99,57.19
315,"LARGE TAHITI BEACH BAG",116,56.61
316,"GREEN ROSE WASHBAG",93,72.35
317,"MINT GREEN ROSE TOWEL",55,6.19
318,"HAND TOWEL PINK FLOWER AND DAISY",21,55.70
319,"RECTANGULAR SHAPED MIRROR",106,29.55
320,"SET OF 3 CONEY ISLAND OVAL BOXES",94,47.97
321,"SET OF 12  VINTAGE POSTCARD SET",59,50.26
322,"SET/4 BLUE FLOWER CANDLES IN BOWL",85,97.07
323,"FRENCH ENAMEL CANDLEHOLDER",15,75.11
324,"SET/6 PINK BIRD T-LIGHT CANDLES",148,59.67
325,"MINI PAINTED GARDEN DECORATION",54,36.17
326,"SET/3 DECOUPAGE STACKING TINS",88,52.55
327,"BLACK VINTAGE EARRINGS",75,92.11
328,"GOLD M.O.P ORBIT DROP EARRINGS",148,84.65
329,"GOLD M.O.P ORBIT BRACELET",94,96.43
330,"NEW BAROQUE B'FLY NECKLACE GREEN",10,41.26
331,"FLOWER GLASS GARLD NECKL36"TURQUOIS",85,36.60
332,"MURANO STYLE GLASS BRACELET BLACK",108,10.21
333,"BLACK DIAMOND CLUSTER EARRINGS",112,47.09
334,"BLUE MURANO TWIST NECKLACE",0,78.75
335,"OLD ROSE COMBO BEAD NECKLACE",89,55.76
336,"WHITE/PINK MINI CRYSTALS NECKLACE",125,43.03
337,"ANT COPPER RED BOUDICCA BRACELET",114,45.29
338,"ANT COPPER TURQ BOUDICCA BRACELET",101,55.76
339,"PINK & WHITE ROSEBUD RING",148,90.65
340,"PAIR BUTTERFLY HAIR CLIPS",29,75.70
341,"DROP DIAMANTE EARRINGS GREEN",3,73.19
342,"AMETHYST GLASS/SHELL/PEARL NECKLACE",136,41.70
343,"JADE DROP EARRINGS W FILIGREE",46,18.55
344,"BLUE SWEETHEART BRACELET",67,97.07
345,"CRYSTAL DIAMANTE STAR BROOCH",102,40.98
346,"DIAMOND LAS VEGAS NECKLACE 45CM",117,43.84
347,"LETTER "S" BLING KEY RING",149,57.36
348,"WHITE STITCHED CUSHION COVER",38,69.51
349,"DIAMANTE HEART SHAPED WALL MIRROR,",127,62.62
350,"PIN CUSHION BABUSHKA RED",95,8.10
351,"PIN CUSHION BABUSHKA BLUE",133,36.85
352,"DOORMAT AIRMAIL",131,74.44
353,"CHILDS GARDEN BRUSH PINK",24,19.35
354,"CHRYSANTHEMUM SKETCHBOOK",20,40.99
355,"VINTAGE UNION JACK DOORSTOP",13,38.01
356,"BAG 500g SWIRLY MARBLES",52,7.37
357,"PACK OF 6 HANDBAG GIFT BOXES",30,7.84
358,"VANILLA SCENT CANDLE JEWELLED BOX",20,5.26
359,"WHITE BAMBOO RIBS LAMPSHADE",103,64.99
360,"FOLDING UMBRELLA CHOCOLATE POLKADOT",78,51.17
361,"CAKE STAND LOVEBIRD 2 TIER WHITE",13,71.15
362,"SET/4 GARDEN ROSE DINNER CANDLE",85,54.60
363,"S/6 SEW ON CROCHET FLOWERS",4,27.74
364,"PORCELAIN ROSE LARGE",105,64.35
365,"DOCTOR'S BAG SOFT TOY",50,48.55
366,"CREAM HEART CARD HOLDER",32,53.78
367,"FLUTED ANTIQUE CANDLE HOLDER",45,44.50
368,"PARTY METAL SIGN",62,73.22
369,"PINK/YELLOW FLOWERS HANDBAG",16,50.78
370,"CHARLIE+LOLA MY ROOM DOOR SIGN",17,9.57
371,"ART LIGHTS,FUNK MONKEY",138,15.31
372,"BALLOON WATER BOMB PACK OF 35",142,12.18
373,"ALPHABET STENCIL CRAFT",40,42.45
374,"PARTY INVITES WOODLAND",74,16.70
375,"PARTY INVITES BALLOON GIRL",115,24.03
376,"PARTY INVITES FOOTBALL",55,39.34
377,"PARTY INVITES SPACEMAN",83,77.05
378,"SWEET PUDDING STICKER SHEET",87,83.19
379,"ASSTD DESIGN 3D PAPER STICKERS",112,70.10
380,"CUTE CATS TAPE",36,53.38
381,"RED WOOLY JUMPER",132,63.25
382,"TOAST ITS - I LOVE YOU",122,15.00
383,"BANK ACCOUNT  GREETING  CARD",147,31.61
384,"BOOZE & WOMEN GREETING CARD",60,61.75
385,"FLYING PIG WATERING CAN",26,47.19
386,"FRENCH BLUE METAL DOOR SIGN 1",48,99.10
387,"3 TRADITIONAl BISCUIT CUTTERS  SET",47,86.59
388,"CAKESTAND, 3 TIER, LOVEHEART",125,60.37
389,"GLASS BELL JAR SMALL",5,94.58
390,"GLASS BELL JAR LARGE",90,9.63
391,"SET 3 WICKER OVAL BASKETS W LIDS",75,96.22
392,"BATH BUILDING BLOCK WORD",53,7.19
393,"WATERING CAN GARDEN MARKER",146,11.40
394,"KINGS CHOICE MUG",61,77.60
395,"FRIDGE MAGNETS LES ENFANTS ASSORTED",53,84.78
396,"PIN CUSHION BABUSHKA PINK",140,23.11
397,"RETRO PLASTIC ELEPHANT TRAY",91,2.44
398,"GOLD MINI TAPE MEASURE",13,28.87
399,"RAINBOW PEGS PHOTO CLIP STRING",21,55.91
400,"ORANGE SCENTED SET/9 T-LIGHTS",10,65.13
401,"TEATIME PEN CASE & PENS",34,81.05
402,"PAPER CHAIN KIT LONDON",65,3.99
403,"RED ENCHANTED FOREST PLACEMAT",34,8.21
404,"CHRISTMAS DECOUPAGE CANDLE",76,63.09
405,"HERB MARKER MINT",145,87.17
406,"HERB MARKER PARSLEY",85,44.61
407,"HERB MARKER THYME",125,82.03
408,"HERB MARKER CHIVES",128,65.57
409,"HERB MARKER ROSEMARY",121,15.19
410,"HERB MARKER BASIL",141,92.61
411,"200 RED + WHITE BENDY STRAWS",65,62.92
412,"SEASIDE FLYING DISC",139,56.30
413,"SET/9 CHRISTMAS T-LIGHTS SCENTED",62,44.27
414,"PEG BAG APPLES DESIGN",142,85.80
415,"JAZZ HEARTS PURSE NOTEBOOK",101,80.31
416,"FEATHER PEN,HOT PINK",88,10.26
417,"WOODEN UNION JACK BUNTING",53,70.22
418,"SMALL WHITE RETROSPOT MUG IN BOX",22,85.82
419,"RED RETROSPOT PUDDING BOWL",139,58.34
420,"DAIRY MAID  PUDDING BOWL",120,53.18
421,"ASSORTED CAKES FRIDGE MAGNETS",13,15.49
422,"DO NOT TOUCH MY STUFF DOOR HANGER",35,35.49
423,"MOODY BOY  DOOR HANGER",47,9.30
424,"FILIGRIS HEART WITH BUTTERFLY",13,91.88
425,"DECORATION HEN ON NEST, HANGING",85,73.02
426,"HEN HOUSE DECORATION",65,82.15
427,"PACK OF 12 STICKY BUNNIES",83,39.14
428,"WOODEN HAPPY BIRTHDAY GARLAND",3,85.37
429,"WOOD STAMP SET BEST WISHES",40,45.10
430,"WOOD STAMP SET HAPPY BIRTHDAY",88,90.63
431,"WOOD STAMP SET THANK YOU",141,12.46
432,"FIVE HEART HANGING DECORATION",112,33.49
433,"CHEST 7 DRAWER MA CAMPAGNE",126,27.26
434,"JUMBO BAG SPACEBOY DESIGN",21,24.90
435,"AIRLINE BAG VINTAGE WORLD CHAMPION",58,22.43
436,"AIRLINE BAG VINTAGE JET SET BROWN",87,81.85
437,"JUMBO BAG DOLLY GIRL DESIGN",115,96.71
438,"CHRISTMAS RETROSPOT HEART WOOD",129,21.90
439,"COSY SLIPPER SHOES LARGE GREEN",124,20.39
440,"COSY SLIPPER SHOES SMALL  RED",49,86.21
441,"COSY SLIPPER SHOES SMALL GREEN",76,54.01
442,"FINE WICKER HEART",57,34.02
443,"STRIPEY CHOCOLATE NESTING BOXES",146,32.75
444,"SWISS CHALET TREE DECORATION",90,57.93
445,"CERAMIC PIRATE CHEST MONEY BANK",102,53.15
446,"SMALL PINK MAGIC CHRISTMAS TREE",78,88.24
447,"SET OF 4 FAIRY CAKE PLACEMATS",68,46.58
448,"RED FLOCK LOVE HEART PHOTO FRAME",33,88.96
449,"SCENTED CANDLE IN DIGITALIS TIN",82,24.85
450,"ORGANISER WOOD ANTIQUE WHITE",42,67.85
451,"RED HEART SHAPE LOVE BUCKET",134,84.17
452,"VINTAGE POST OFFICE CABINET",10,60.59
453,"STAR PORTABLE TABLE LIGHT",2,2.24
454,"CLEAR MILKSHAKE GLASS",132,3.53
455,"BIRDS MOBILE VINTAGE DESIGN",147,98.19
456,"DINOSAUR LUNCH BOX WITH CUTLERY",21,53.93
457,"FAIRY CAKE BIRTHDAY CANDLE SET",57,74.62
458,"CHARLIE AND LOLA TABLE TINS",150,17.06
459,"CUPCAKE LACE PAPER SET 6",43,71.07
460,"GREEN POLKADOT BOWL",111,22.78
461,"BLUE POLKADOT BOWL",37,80.09
462,"BLUE POLKADOT PLATE",97,64.57
463,"GREEN POLKADOT PLATE",139,2.38
464,"SKULLS  STICKERS",15,36.61
465,"SKULL AND CROSSBONES  GARLAND",69,10.60
466,"PACK OF 6 SKULL PAPER CUPS",141,79.97
467,"PACK OF 20 SKULL PAPER NAPKINS",24,37.55
468,"SKULLS PARTY BAG + STICKER SET",108,6.94
469,"PINK PARTY BAGS",82,40.76
470,"BLUE PARTY BAGS",16,87.31
471,"15CM CHRISTMAS GLASS BALL 20 LIGHTS",114,73.68
472,"BAG 125g SWIRLY MARBLES",123,96.67
473,"SET OF 6 T-LIGHTS WEDDING CAKE",133,37.77
474,"MINI CAKE STAND T-LIGHT HOLDER",129,14.03
475,"ROUND CAKE TIN VINTAGE RED",4,97.03
476,"WELCOME  WOODEN BLOCK LETTERS",102,34.93
477,"BLACK TEA,COFFEE,SUGAR JARS",1,49.58
478,"VANILLA INCENSE 40 CONES IN TIN",28,39.18
479,"COLUMBIAN CANDLE RECTANGLE",77,45.62
480,"ENGLISH ROSE SPIRIT LEVEL",111,35.02
481,"SMALL SQUARE CUT GLASS CANDLESTICK",106,44.55
482,"LADYBIRD + BEE RAFFIA FOOD COVER",124,37.93
483,"ARMY CAMO BOOKCOVER TAPE",74,45.45
484,"CARROT CHARLIE+LOLA COASTER SET",79,95.82
485,"DOG BOWL CHASING BALL DESIGN",89,72.84
486,"UNION STRIPE WITH FRINGE  HAMMOCK",36,44.09
487,"RETROSPOT SMALL TUBE MATCHES",21,35.87
488,"CREAM WALL PLANTER HEART SHAPED",16,25.79
489,"CHILDS GARDEN SPADE BLUE",119,33.49
490,"SKULLS STORAGE BOX SMALL",105,47.17
491,"200 BENDY SKULL STRAWS",82,14.61
492,"COLOUR GLASS T-LIGHT HOLDER HANGING",91,78.89
493,"SPACEBOY GIFT WRAP",143,69.30
494,"BLUE GLASS CHUNKY CHARM BRACELET",25,26.64
495,"BLACK+WHITE NECKLACE W TASSEL",31,53.90
496,"AMBER CHUNKY GLASS+BEAD NECKLACE",12,67.39
497,"GINGHAM ROSE WRAP",147,47.75
498,"FOOD/DRINK SPONGE STICKERS",59,33.52
499,"PINK HEART SHAPE PHOTO FRAME",64,65.31
500,"LILAC DIAMANTE PEN IN GIFT BOX",99,90.88
501,"SILVER DIAMANTE PEN IN GIFT BOX",32,9.52
502,"BLUE JUICY FRUIT PHOTO FRAME",53,62.74
503,"GREEN JUICY FRUIT PHOTO FRAME",113,24.19
504,"36 FOIL STAR CAKE CASES",142,66.73
505,"S/4 VALENTINE DECOUPAGE HEART BOX",112,66.23
506,"BASKET OF FLOWERS SEWING KIT",106,64.43
507,"TRIPLE PHOTO FRAME CORNICE",3,27.06
508,"SET OF 4 NAPKIN CHARMS CUTLERY",69,18.60
509,"VINTAGE CREAM 3 BASKET CAKE STAND",94,30.23
510,"DIAMANTE BOW BROOCH BLACK COLOUR",43,7.04
511,"DIAMANTE BOW BROOCH GREEN COLOUR",85,12.37
512,"DIAMANTE BOW BROOCH RED COLOUR",50,25.18
513,"LILY BROOCH AMETHYST COLOUR",68,90.47
514,"PAIR OF ENAMEL BUTTERFLY HAIRCLIP",76,95.94
515,"AMETHYST DIAMANTE EXPANDABLE RING",31,60.47
516,"BLACK DIAMANTE EXPANDABLE RING",21,48.92
517,"PURPLE GEMSTONE BRACELET",46,21.51
518,"PURPLE GEMSTONE NECKLACE 45CM",134,9.05
519,"5 STRAND GLASS NECKLACE BLACK",82,70.39
520,"DROP DIAMANTE EARRINGS CRYSTAL",21,84.50
521,"AMETHYST HOOP EARRING FLORAL LEAF",20,81.09
522,"HANGING BAUBLE T-LIGHT HOLDER LARGE",94,54.16
523,"GOLD PRINT PAPER BAG",125,9.33
524,"RED TEA TOWEL CLASSIC DESIGN",4,23.49
525,"CLAM SHELL LARGE",93,78.65
526,"COCKLE SHELL DISH",150,74.03
527,"PARTY PIZZA DISH RED RETROSPOT",92,34.34
528,"PINK TALL PORCELAIN T-LIGHT HOLDER",139,57.97
529,"WHITE TALL PORCELAIN T-LIGHT HOLDER",23,43.54
530,"TV DINNER TRAY DOLLY GIRL",7,37.58
531,"CLAM SHELL SMALL",74,12.54
532,"BLACK RECORD COVER FRAME",98,65.22
533,"CHRYSANTHEMUM POCKET BOOK",68,56.81
534,"GARDEN PATH POCKET BOOK",13,71.12
535,"RED DAISY POCKET BOOK",150,57.11
536,"BLUE PAISLEY POCKET BOOK",145,21.17
537,"BIRTHDAY PARTY CORDON BARRIER TAPE",125,43.15
538,"FROG SOCK PUPPET",127,74.38
539,"PINK HORSE SOCK PUPPET",69,15.86
540,"BLUE GEISHA GIRL",47,12.94
541,"GREEN GEISHA GIRL",9,6.95
542,"PINK SWEETHEART BRACELET",136,18.91
543,"PURPLE SWEETHEART BRACELET",78,71.12
544,"SPACEBOY CHILDRENS EGG CUP",116,65.66
545,"MOBILE VINTAGE HEARTS",130,33.16
546,"SET OF 2 TEA TOWELS APPLE AND PEARS",78,6.65
547,"6 ROCKET BALLOONS",88,53.99
548,"CAKE STAND VICTORIAN FILIGREE MED",145,54.35
549,"BLACK WINE GLASS",65,43.14
550,"CLASSICAL ROSE CANDLESTAND",53,92.32
551,"BLACK CHAMPAGNE GLASS",10,12.12
552,"FRIDGE MAGNETS LA VIE EN ROSE",46,88.51
553,"YELLOW GIANT GARDEN THERMOMETER",8,71.14
554,"PINK DOUGHNUT TRINKET POT",83,42.86
555,"LARGE HANGING IVORY & RED WOOD BIRD",38,94.55
556,"WRAP, BILLBOARD FONTS DESIGN",18,29.46
557,"GIFT BAG PSYCHEDELIC APPLES",136,50.37
558,"CARD PSYCHEDELIC APPLES",77,38.76
559,"BLACK ENCHANTED FOREST PLACEMAT",67,78.18
560,"FOREST GREEN JUMPER",12,99.13
561,"RED RETROSPOT TAPE",147,95.92
562,"4 ROSE PINK DINNER CANDLES",20,40.39
563,"4 SKY BLUE DINNER CANDLES",78,61.58
564,"TWO DOOR CURIO CABINET",99,47.69
565,"3 TRADITIONAL COOKIE CUTTERS  SET",3,22.78
566,"PORCELAIN ROSE SMALL",118,4.03
567,"Bank Charges",123,63.94
568,"WHITE SPOT RED CERAMIC DRAWER KNOB",69,38.71
569,"LOVE GARLAND PAINTED ZINC",70,77.61
570,"BLACK CANDELABRA T-LIGHT HOLDER",16,84.06
571,"HANGING JAM JAR T-LIGHT HOLDER",104,85.71
572,"MAGIC DRAWING SLATE PURDEY",128,48.13
573,"MAGIC DRAWING SLATE BAKE A CAKE",63,37.77
574,"MEASURING TAPE BABUSHKA BLUE",64,99.79
575,"IVORY EMBROIDERED QUILT",146,90.52
576,"FELT FARM ANIMAL WHITE BUNNY",5,54.96
577,"LOVELY BONBON STICKER SHEET",137,79.25
578,"SNOWSTORM PHOTO FRAME FRIDGE MAGNET",1,52.10
579,"VINTAGE BLUE TINSEL REEL",28,44.36
580,"MIRROR LOVE BIRD T-LIGHT HOLDER",148,39.03
581,"BLACK LOVE BIRD T-LIGHT HOLDER",61,53.41
582,"JARDIN ETCHED GLASS BUTTER DISH",43,33.54
583,"SPACE CADET BLACK",7,40.34
584,"SPACE CADET RED",41,81.09
585,"SPACE CADET WHITE",129,81.05
586,"AIRLINE BAG VINTAGE JET SET WHITE",147,58.43
587,"RED POLKADOT PUDDING BOWL",106,8.33
588,"BLUE POLKADOT PUDDING BOWL",140,3.47
589,"ILLUSTRATED CAT BOWL",36,75.98
590,"TOAST ITS - BEST MUM",30,91.73
591,"TOAST ITS - DINOSAUR",90,33.78
592,"DOLLY GIRL CHILDRENS EGG CUP",37,64.35
593,"CHILDRENS DOLLY GIRL MUG",82,53.54
594,"GARDEN PATH SKETCHBOOK",90,72.54
595,"RED POLKADOT COFFEE  MUG",38,61.88
596,"BLUE POLKADOT COFFEE MUG",128,21.12
597,"SET/12 TAPER CANDLES",37,76.85
598,"CITRONELLA CANDLE GARDEN POT",107,28.99
599,"MAKE YOUR OWN MONSOON CARD KIT",111,73.13
600,"SWIRLY CIRCULAR RUBBERS IN BAG",102,74.55
601,"WOODLAND DESIGN  COTTON TOTE BAG",120,70.25
602,"COSY HOUR GIANT TUBE MATCHES",9,26.66
603,"WOODLAND STORAGE BOX SMALL",55,75.92
604,"SET OF 72 GREEN PAPER DOILIES",126,46.55
605,"SKULLS  DESIGN  COTTON TOTE BAG",33,59.92
606,"FLOWER BURST SILVER RING CRYSTAL",137,26.84
